article_id,Comment,source,Stop_Words_Removed,Stemmed_data,Lemmatized_data,Message_length,Punctuation_Percent
5,"Federer, 37, first broke through on tour over two decades ago and he has since gone on to enjoy a glittering career. The 20-time Grand Slam winner is chasing his 99th ATP title at the Swiss Indoors this week and he faces Jan-Lennard Struff in the second round on Thursday (6pm BST). Davenport enjoyed most of her success in the late 1990s and her third and final major tournament win came at the 2000 Australian Open. But she claims the mentality of professional tennis players slowly began to change after the new millennium. ""It seems pretty friendly right now,"" said Davenport. ""I think there is a really nice environment and a great atmosphere, especially between some of the veteran players helping some of the younger players out. ""It's a very pleasant atmosphere, I'd have to say, around the locker rooms. ""I felt like the best weeks that I had to get to know players when I was playing were the Fed Cup weeks or the Olympic weeks, not necessarily during the tournaments. ""And even though maybe we had smaller teams, I still think we kept to ourselves quite a bit. ""Not always, but I really feel like in the mid-2000 years there was a huge shift of the attitudes of the top players and being more friendly and being more giving, and a lot of that had to do with players like Roger coming up. ""I just felt like it really kind of changed where people were a little bit, definitely in the 90s, a lot more quiet, into themselves, and then it started to become better."" Meanwhile, Federer is hoping he can improve his service game as he hunts his ninth Swiss Indoors title this week. ""I didn't serve very well [against first-round opponent Filip Kranjovic,"" Federer said. ""I think I was misfiring the corners, I was not hitting the lines enough. ""Clearly you make your life more difficult, but still I was up 6-2, 3-1, break points, so things could have ended very quickly today, even though I didn't have the best serve percentage stats. ""But maybe that's exactly what caught up to me eventually. It's just getting used to it. This is where the first rounds can be tricky.""",https://www.express.co.uk/sport/tennis/1036101/Roger-Federer-Swiss-Indoors-Jan-Lennard-Struff-Lindsay-Davenport,"['federer', '37', 'first', 'broke', 'tour', 'two', 'decades', 'ago', 'since', 'gone', 'enjoy', 'glittering', 'career', '20time', 'grand', 'slam', 'winner', 'chasing', '99th', 'atp', 'title', 'swiss', 'indoors', 'week', 'faces', 'janlennard', 'struff', 'second', 'round', 'thursday', '6pm', 'bst', 'davenport', 'enjoyed', 'success', 'late', '1990s', 'third', 'final', 'major', 'tournament', 'win', 'came', '2000', 'australian', 'open', 'claims', 'mentality', 'professional', 'tennis', 'players', 'slowly', 'began', 'change', 'new', 'millennium', 'seems', 'pretty', 'friendly', 'right', 'said', 'davenport', 'think', 'really', 'nice', 'environment', 'great', 'atmosphere', 'especially', 'veteran', 'players', 'helping', 'younger', 'players', 'pleasant', 'atmosphere', 'id', 'say', 'around', 'locker', 'rooms', 'felt', 'like', 'best', 'weeks', 'get', 'know', 'players', 'playing', 'fed', 'cup', 'weeks', 'olympic', 'weeks', 'necessarily', 'tournaments', 'even', 'though', 'maybe', 'smaller', 'teams', 'still', 'think', 'kept', 'quite', 'bit', 'always', 'really', 'feel', 'like', 'mid2000', 'years', 'huge', 'shift', 'attitudes', 'top', 'players', 'friendly', 'giving', 'lot', 'players', 'like', 'roger', 'coming', 'felt', 'like', 'really', 'kind', 'changed', 'people', 'little', 'bit', 'definitely', '90s', 'lot', 'quiet', 'started', 'become', 'better', 'meanwhile', 'federer', 'hoping', 'improve', 'service', 'game', 'hunts', 'ninth', 'swiss', 'indoors', 'title', 'week', 'didnt', 'serve', 'well', 'firstround', 'opponent', 'filip', 'kranjovic', 'federer', 'said', 'think', 'misfiring', 'corners', 'hitting', 'lines', 'enough', 'clearly', 'make', 'life', 'difficult', 'still', '62', '31', 'break', 'points', 'things', 'could', 'ended', 'quickly', 'today', 'even', 'though', 'didnt', 'best', 'serve', 'percentage', 'stats', 'maybe', 'thats', 'exactly', 'caught', 'eventually', 'getting', 'used', 'first', 'rounds', 'tricky']","['feder', '37', 'first', 'broke', 'tour', 'two', 'decad', 'ago', 'sinc', 'gone', 'enjoy', 'glitter', 'career', '20time', 'grand', 'slam', 'winner', 'chase', '99th', 'atp', 'titl', 'swiss', 'indoor', 'week', 'face', 'janlennard', 'struff', 'second', 'round', 'thursday', '6pm', 'bst', 'davenport', 'enjoy', 'success', 'late', '1990', 'third', 'final', 'major', 'tournament', 'win', 'came', '2000', 'australian', 'open', 'claim', 'mental', 'profession', 'tenni', 'player', 'slowli', 'began', 'chang', 'new', 'millennium', 'seem', 'pretti', 'friendli', 'right', 'said', 'davenport', 'think', 'realli', 'nice', 'environ', 'great', 'atmospher', 'especi', 'veteran', 'player', 'help', 'younger', 'player', 'pleasant', 'atmospher', 'id', 'say', 'around', 'locker', 'room', 'felt', 'like', 'best', 'week', 'get', 'know', 'player', 'play', 'fed', 'cup', 'week', 'olymp', 'week', 'necessarili', 'tournament', 'even', 'though', 'mayb', 'smaller', 'team', 'still', 'think', 'kept', 'quit', 'bit', 'alway', 'realli', 'feel', 'like', 'mid2000', 'year', 'huge', 'shift', 'attitud', 'top', 'player', 'friendli', 'give', 'lot', 'player', 'like', 'roger', 'come', 'felt', 'like', 'realli', 'kind', 'chang', 'peopl', 'littl', 'bit', 'definit', '90', 'lot', 'quiet', 'start', 'becom', 'better', 'meanwhil', 'feder', 'hope', 'improv', 'servic', 'game', 'hunt', 'ninth', 'swiss', 'indoor', 'titl', 'week', 'didnt', 'serv', 'well', 'firstround', 'oppon', 'filip', 'kranjov', 'feder', 'said', 'think', 'misfir', 'corner', 'hit', 'line', 'enough', 'clearli', 'make', 'life', 'difficult', 'still', '62', '31', 'break', 'point', 'thing', 'could', 'end', 'quickli', 'today', 'even', 'though', 'didnt', 'best', 'serv', 'percentag', 'stat', 'mayb', 'that', 'exactli', 'caught', 'eventu', 'get', 'use', 'first', 'round', 'tricki']","['federer', '37', 'first', 'broke', 'tour', 'two', 'decade', 'ago', 'since', 'gone', 'enjoy', 'glittering', 'career', '20time', 'grand', 'slam', 'winner', 'chasing', '99th', 'atp', 'title', 'swiss', 'indoors', 'week', 'face', 'janlennard', 'struff', 'second', 'round', 'thursday', '6pm', 'bst', 'davenport', 'enjoyed', 'success', 'late', '1990s', 'third', 'final', 'major', 'tournament', 'win', 'came', '2000', 'australian', 'open', 'claim', 'mentality', 'professional', 'tennis', 'player', 'slowly', 'began', 'change', 'new', 'millennium', 'seems', 'pretty', 'friendly', 'right', 'said', 'davenport', 'think', 'really', 'nice', 'environment', 'great', 'atmosphere', 'especially', 'veteran', 'player', 'helping', 'younger', 'player', 'pleasant', 'atmosphere', 'id', 'say', 'around', 'locker', 'room', 'felt', 'like', 'best', 'week', 'get', 'know', 'player', 'playing', 'fed', 'cup', 'week', 'olympic', 'week', 'necessarily', 'tournament', 'even', 'though', 'maybe', 'smaller', 'team', 'still', 'think', 'kept', 'quite', 'bit', 'always', 'really', 'feel', 'like', 'mid2000', 'year', 'huge', 'shift', 'attitude', 'top', 'player', 'friendly', 'giving', 'lot', 'player', 'like', 'roger', 'coming', 'felt', 'like', 'really', 'kind', 'changed', 'people', 'little', 'bit', 'definitely', '90', 'lot', 'quiet', 'started', 'become', 'better', 'meanwhile', 'federer', 'hoping', 'improve', 'service', 'game', 'hunt', 'ninth', 'swiss', 'indoors', 'title', 'week', 'didnt', 'serve', 'well', 'firstround', 'opponent', 'filip', 'kranjovic', 'federer', 'said', 'think', 'misfiring', 'corner', 'hitting', 'line', 'enough', 'clearly', 'make', 'life', 'difficult', 'still', '62', '31', 'break', 'point', 'thing', 'could', 'ended', 'quickly', 'today', 'even', 'though', 'didnt', 'best', 'serve', 'percentage', 'stats', 'maybe', 'thats', 'exactly', 'caught', 'eventually', 'getting', 'used', 'first', 'round', 'tricky']",2076,3.371868978805395
6,"Nadal has not played tennis since he was forced to retire from the US Open semi-finals against Juan Martin Del Porto with a knee injury. The world No 1 has been forced to miss Spain's Davis Cup clash with France and the Asian hard court season. But with the ATP World Tour Finals due to begin next month, Nadal is ready to prove his fitness before the season-ending event at the 02 Arena. Nadal flew to Paris on Friday and footage from the Paris Masters official Twitter account shows the Spaniard smiling as he strides onto court for practice. The Paris Masters draw has been made and Nadal will start his campaign on Tuesday or Wednesday against either Fernando Verdasco or Jeremy Chardy. Nadal could then play defending champion Jack Sock in the third round before a potential quarter-final with either Borna Coric or Dominic Thiem. Nadal's appearance in Paris is a big boost to the tournament organisers who could see Roger Federer withdraw. Federer is in action at the Swiss Indoors in Basel and if he reaches the final, he could pull out of Paris in a bid to stay fresh for London. But as it stands, Federer is in the draw and is scheduled to face either former world No 3 Milos Raonic or Jo-Wilfried Tsonga in the second round. Federer's projected route to the Paris final could also lead to matches against Kevin Anderson and Novak Djokovic. Djokovic could play Marco Cecchinato in the second round. British No 1 Kyle Edmund is the 12th seed in Paris and will get underway in round two against either Karen Khachanov or Filip Krajinovic.",https://www.express.co.uk/sport/tennis/1037119/Rafael-Nadal-World-No-1-Paris-Masters-Federer-Djokovic,"['nadal', 'played', 'tennis', 'since', 'forced', 'retire', 'us', 'open', 'semifinals', 'juan', 'martin', 'del', 'porto', 'knee', 'injury', 'world', '1', 'forced', 'miss', 'spains', 'davis', 'cup', 'clash', 'france', 'asian', 'hard', 'court', 'season', 'atp', 'world', 'tour', 'finals', 'due', 'begin', 'next', 'month', 'nadal', 'ready', 'prove', 'fitness', 'seasonending', 'event', '02', 'arena', 'nadal', 'flew', 'paris', 'friday', 'footage', 'paris', 'masters', 'official', 'twitter', 'account', 'shows', 'spaniard', 'smiling', 'strides', 'onto', 'court', 'practice', 'paris', 'masters', 'draw', 'made', 'nadal', 'start', 'campaign', 'tuesday', 'wednesday', 'either', 'fernando', 'verdasco', 'jeremy', 'chardy', 'nadal', 'could', 'play', 'defending', 'champion', 'jack', 'sock', 'third', 'round', 'potential', 'quarterfinal', 'either', 'borna', 'coric', 'dominic', 'thiem', 'nadals', 'appearance', 'paris', 'big', 'boost', 'tournament', 'organisers', 'could', 'see', 'roger', 'federer', 'withdraw', 'federer', 'action', 'swiss', 'indoors', 'basel', 'reaches', 'final', 'could', 'pull', 'paris', 'bid', 'stay', 'fresh', 'london', 'stands', 'federer', 'draw', 'scheduled', 'face', 'either', 'former', 'world', '3', 'milos', 'raonic', 'jowilfried', 'tsonga', 'second', 'round', 'federers', 'projected', 'route', 'paris', 'final', 'could', 'also', 'lead', 'matches', 'kevin', 'anderson', 'novak', 'djokovic', 'djokovic', 'could', 'play', 'marco', 'cecchinato', 'second', 'round', 'british', '1', 'kyle', 'edmund', '12th', 'seed', 'paris', 'get', 'underway', 'round', 'two', 'either', 'karen', 'khachanov', 'filip', 'krajinovic']","['nadal', 'play', 'tenni', 'sinc', 'forc', 'retir', 'us', 'open', 'semifin', 'juan', 'martin', 'del', 'porto', 'knee', 'injuri', 'world', '1', 'forc', 'miss', 'spain', 'davi', 'cup', 'clash', 'franc', 'asian', 'hard', 'court', 'season', 'atp', 'world', 'tour', 'final', 'due', 'begin', 'next', 'month', 'nadal', 'readi', 'prove', 'fit', 'seasonend', 'event', '02', 'arena', 'nadal', 'flew', 'pari', 'friday', 'footag', 'pari', 'master', 'offici', 'twitter', 'account', 'show', 'spaniard', 'smile', 'stride', 'onto', 'court', 'practic', 'pari', 'master', 'draw', 'made', 'nadal', 'start', 'campaign', 'tuesday', 'wednesday', 'either', 'fernando', 'verdasco', 'jeremi', 'chardi', 'nadal', 'could', 'play', 'defend', 'champion', 'jack', 'sock', 'third', 'round', 'potenti', 'quarterfin', 'either', 'borna', 'coric', 'domin', 'thiem', 'nadal', 'appear', 'pari', 'big', 'boost', 'tournament', 'organis', 'could', 'see', 'roger', 'feder', 'withdraw', 'feder', 'action', 'swiss', 'indoor', 'basel', 'reach', 'final', 'could', 'pull', 'pari', 'bid', 'stay', 'fresh', 'london', 'stand', 'feder', 'draw', 'schedul', 'face', 'either', 'former', 'world', '3', 'milo', 'raonic', 'jowilfri', 'tsonga', 'second', 'round', 'feder', 'project', 'rout', 'pari', 'final', 'could', 'also', 'lead', 'match', 'kevin', 'anderson', 'novak', 'djokov', 'djokov', 'could', 'play', 'marco', 'cecchinato', 'second', 'round', 'british', '1', 'kyle', 'edmund', '12th', 'seed', 'pari', 'get', 'underway', 'round', 'two', 'either', 'karen', 'khachanov', 'filip', 'krajinov']","['nadal', 'played', 'tennis', 'since', 'forced', 'retire', 'u', 'open', 'semifinal', 'juan', 'martin', 'del', 'porto', 'knee', 'injury', 'world', '1', 'forced', 'miss', 'spain', 'davis', 'cup', 'clash', 'france', 'asian', 'hard', 'court', 'season', 'atp', 'world', 'tour', 'final', 'due', 'begin', 'next', 'month', 'nadal', 'ready', 'prove', 'fitness', 'seasonending', 'event', '02', 'arena', 'nadal', 'flew', 'paris', 'friday', 'footage', 'paris', 'master', 'official', 'twitter', 'account', 'show', 'spaniard', 'smiling', 'stride', 'onto', 'court', 'practice', 'paris', 'master', 'draw', 'made', 'nadal', 'start', 'campaign', 'tuesday', 'wednesday', 'either', 'fernando', 'verdasco', 'jeremy', 'chardy', 'nadal', 'could', 'play', 'defending', 'champion', 'jack', 'sock', 'third', 'round', 'potential', 'quarterfinal', 'either', 'borna', 'coric', 'dominic', 'thiem', 'nadals', 'appearance', 'paris', 'big', 'boost', 'tournament', 'organiser', 'could', 'see', 'roger', 'federer', 'withdraw', 'federer', 'action', 'swiss', 'indoors', 'basel', 'reach', 'final', 'could', 'pull', 'paris', 'bid', 'stay', 'fresh', 'london', 'stand', 'federer', 'draw', 'scheduled', 'face', 'either', 'former', 'world', '3', 'milo', 'raonic', 'jowilfried', 'tsonga', 'second', 'round', 'federers', 'projected', 'route', 'paris', 'final', 'could', 'also', 'lead', 'match', 'kevin', 'anderson', 'novak', 'djokovic', 'djokovic', 'could', 'play', 'marco', 'cecchinato', 'second', 'round', 'british', '1', 'kyle', 'edmund', '12th', 'seed', 'paris', 'get', 'underway', 'round', 'two', 'either', 'karen', 'khachanov', 'filip', 'krajinovic']",1545,1.4239482200647249
7,"Tennis giveth, and tennis taketh away. The end of the season is finally in sight, and with so many players defending,or losing,huge chunks of points in Singapore, Zhuhai and London, podcast co-hosts Nina Pantic and Irina Falconi discuss the art of defending points (02:14). It's no secret that Jack Sock has struggled on the singles court this year (his record is 7-19). He could lose 1,400 points in the next few weeks, but instead of focusing on the negative, it can all be about perspective (06:28). Let's also not forget his two Grand Slam doubles triumphs this season. Two players, Stefanos Tsitsipas and Kyle Edmund, won their first career ATP titles last week (13:26). It's a big deal because you never forget your first. Irina looks back at her WTA title win in Bogota in 2016, and tells an unforgettable story about her semifinal drama (14:04). In Singapore, one of the biggest storylines (aside from the matches, of course) has been the on-court coaching debate. Nina and Irina give their opinions on what coaching should look like in the future, on both tours (18:55).",http://www.tennis.com/pro-game/2018/10/tenniscom-podcast-irina-falconi-jack-sock-rafael-nadal-singapore/77698/,"['tennis', 'giveth', 'tennis', 'taketh', 'away', 'end', 'season', 'finally', 'sight', 'many', 'players', 'defendingor', 'losinghuge', 'chunks', 'points', 'singapore', 'zhuhai', 'london', 'podcast', 'cohosts', 'nina', 'pantic', 'irina', 'falconi', 'discuss', 'art', 'defending', 'points', '0214', 'secret', 'jack', 'sock', 'struggled', 'singles', 'court', 'year', 'record', '719', 'could', 'lose', '1400', 'points', 'next', 'weeks', 'instead', 'focusing', 'negative', 'perspective', '0628', 'lets', 'also', 'forget', 'two', 'grand', 'slam', 'doubles', 'triumphs', 'season', 'two', 'players', 'stefanos', 'tsitsipas', 'kyle', 'edmund', 'first', 'career', 'atp', 'titles', 'last', 'week', '1326', 'big', 'deal', 'never', 'forget', 'first', 'irina', 'looks', 'back', 'wta', 'title', 'win', 'bogota', '2016', 'tells', 'unforgettable', 'story', 'semifinal', 'drama', '1404', 'singapore', 'one', 'biggest', 'storylines', 'aside', 'matches', 'course', 'oncourt', 'coaching', 'debate', 'nina', 'irina', 'give', 'opinions', 'coaching', 'look', 'like', 'future', 'tours', '1855']","['tenni', 'giveth', 'tenni', 'taketh', 'away', 'end', 'season', 'final', 'sight', 'mani', 'player', 'defendingor', 'losinghug', 'chunk', 'point', 'singapor', 'zhuhai', 'london', 'podcast', 'cohost', 'nina', 'pantic', 'irina', 'falconi', 'discuss', 'art', 'defend', 'point', '0214', 'secret', 'jack', 'sock', 'struggl', 'singl', 'court', 'year', 'record', '719', 'could', 'lose', '1400', 'point', 'next', 'week', 'instead', 'focus', 'neg', 'perspect', '0628', 'let', 'also', 'forget', 'two', 'grand', 'slam', 'doubl', 'triumph', 'season', 'two', 'player', 'stefano', 'tsitsipa', 'kyle', 'edmund', 'first', 'career', 'atp', 'titl', 'last', 'week', '1326', 'big', 'deal', 'never', 'forget', 'first', 'irina', 'look', 'back', 'wta', 'titl', 'win', 'bogota', '2016', 'tell', 'unforgett', 'stori', 'semifin', 'drama', '1404', 'singapor', 'one', 'biggest', 'storylin', 'asid', 'match', 'cours', 'oncourt', 'coach', 'debat', 'nina', 'irina', 'give', 'opinion', 'coach', 'look', 'like', 'futur', 'tour', '1855']","['tennis', 'giveth', 'tennis', 'taketh', 'away', 'end', 'season', 'finally', 'sight', 'many', 'player', 'defendingor', 'losinghuge', 'chunk', 'point', 'singapore', 'zhuhai', 'london', 'podcast', 'cohosts', 'nina', 'pantic', 'irina', 'falconi', 'discus', 'art', 'defending', 'point', '0214', 'secret', 'jack', 'sock', 'struggled', 'single', 'court', 'year', 'record', '719', 'could', 'lose', '1400', 'point', 'next', 'week', 'instead', 'focusing', 'negative', 'perspective', '0628', 'let', 'also', 'forget', 'two', 'grand', 'slam', 'double', 'triumph', 'season', 'two', 'player', 'stefanos', 'tsitsipas', 'kyle', 'edmund', 'first', 'career', 'atp', 'title', 'last', 'week', '1326', 'big', 'deal', 'never', 'forget', 'first', 'irina', 'look', 'back', 'wta', 'title', 'win', 'bogota', '2016', 'tell', 'unforgettable', 'story', 'semifinal', 'drama', '1404', 'singapore', 'one', 'biggest', 'storyline', 'aside', 'match', 'course', 'oncourt', 'coaching', 'debate', 'nina', 'irina', 'give', 'opinion', 'coaching', 'look', 'like', 'future', 'tour', '1855']",1079,4.633920296570899
8,"Federer won the Swiss Indoors last week by beating Romanian qualifier Marius Copil in the final. The 37-year-old claimed his 99th ATP title and is hunting the century in the French capital this week. Federer has been handed a difficult draw where could could come across Kevin Anderson, Novak Djokovic and Rafael Nadal in the latter rounds. But first the 20-time Grand Slam winner wants to train on the Paris Masters court this afternoon before deciding whether to appear for his opening match against either Milos Raonic or Jo-Wilfried Tsonga. ""On Monday, I am free and will look how I feel,"" Federer said after winning the Swiss Indoors. ""On Tuesday I will fly to Paris and train in the afternoon to be ready for my first match on Wednesday night. ""I felt good all week and better every day. ""We also had the impression that at this stage it might be better to play matches than to train. ""And as long as I fear no injury, I play."" Federer's success in Basel last week was the ninth time he has won his hometown tournament. And he was delighted to be watched on by all of his family and friends as he purchased 60 tickets for the final for those dearest to him. ""My children, my parents, my sister and my team are all there,"" Federer added. ""It is always very emotional for me to thank my team. And sometimes it tilts with the emotions, sometimes I just stumble. ""It means the world to me. It makes me incredibly happy to win my home tournament and make people happy here. ""I do not know if it's maybe my last title, so today I try a lot more to absorb that and enjoy the moments much more consciously. ""Maybe I should celebrate as if it were my last title. ""There are very touching moments: seeing the ball children, the standing ovations, all the familiar faces in the audience. Because it was not always easy in the last weeks.""",https://www.express.co.uk/sport/tennis/1038186/Roger-Federer-set-for-crunch-Paris-Masters-decision-today,"['federer', 'swiss', 'indoors', 'last', 'week', 'beating', 'romanian', 'qualifier', 'marius', 'copil', 'final', '37yearold', 'claimed', '99th', 'atp', 'title', 'hunting', 'century', 'french', 'capital', 'week', 'federer', 'handed', 'difficult', 'draw', 'could', 'could', 'come', 'across', 'kevin', 'anderson', 'novak', 'djokovic', 'rafael', 'nadal', 'latter', 'rounds', 'first', '20time', 'grand', 'slam', 'winner', 'wants', 'train', 'paris', 'masters', 'court', 'afternoon', 'deciding', 'whether', 'appear', 'opening', 'match', 'either', 'milos', 'raonic', 'jowilfried', 'tsonga', 'monday', 'free', 'look', 'feel', 'federer', 'said', 'winning', 'swiss', 'indoors', 'tuesday', 'fly', 'paris', 'train', 'afternoon', 'ready', 'first', 'match', 'wednesday', 'night', 'felt', 'good', 'week', 'better', 'every', 'day', 'also', 'impression', 'stage', 'might', 'better', 'play', 'matches', 'train', 'long', 'fear', 'injury', 'play', 'federers', 'success', 'basel', 'last', 'week', 'ninth', 'time', 'hometown', 'tournament', 'delighted', 'watched', 'family', 'friends', 'purchased', '60', 'tickets', 'final', 'dearest', 'children', 'parents', 'sister', 'team', 'federer', 'added', 'always', 'emotional', 'thank', 'team', 'sometimes', 'tilts', 'emotions', 'sometimes', 'stumble', 'means', 'world', 'makes', 'incredibly', 'happy', 'win', 'home', 'tournament', 'make', 'people', 'happy', 'know', 'maybe', 'last', 'title', 'today', 'try', 'lot', 'absorb', 'enjoy', 'moments', 'much', 'consciously', 'maybe', 'celebrate', 'last', 'title', 'touching', 'moments', 'seeing', 'ball', 'children', 'standing', 'ovations', 'familiar', 'faces', 'audience', 'always', 'easy', 'last', 'weeks']","['feder', 'swiss', 'indoor', 'last', 'week', 'beat', 'romanian', 'qualifi', 'mariu', 'copil', 'final', '37yearold', 'claim', '99th', 'atp', 'titl', 'hunt', 'centuri', 'french', 'capit', 'week', 'feder', 'hand', 'difficult', 'draw', 'could', 'could', 'come', 'across', 'kevin', 'anderson', 'novak', 'djokov', 'rafael', 'nadal', 'latter', 'round', 'first', '20time', 'grand', 'slam', 'winner', 'want', 'train', 'pari', 'master', 'court', 'afternoon', 'decid', 'whether', 'appear', 'open', 'match', 'either', 'milo', 'raonic', 'jowilfri', 'tsonga', 'monday', 'free', 'look', 'feel', 'feder', 'said', 'win', 'swiss', 'indoor', 'tuesday', 'fli', 'pari', 'train', 'afternoon', 'readi', 'first', 'match', 'wednesday', 'night', 'felt', 'good', 'week', 'better', 'everi', 'day', 'also', 'impress', 'stage', 'might', 'better', 'play', 'match', 'train', 'long', 'fear', 'injuri', 'play', 'feder', 'success', 'basel', 'last', 'week', 'ninth', 'time', 'hometown', 'tournament', 'delight', 'watch', 'famili', 'friend', 'purchas', '60', 'ticket', 'final', 'dearest', 'children', 'parent', 'sister', 'team', 'feder', 'ad', 'alway', 'emot', 'thank', 'team', 'sometim', 'tilt', 'emot', 'sometim', 'stumbl', 'mean', 'world', 'make', 'incred', 'happi', 'win', 'home', 'tournament', 'make', 'peopl', 'happi', 'know', 'mayb', 'last', 'titl', 'today', 'tri', 'lot', 'absorb', 'enjoy', 'moment', 'much', 'conscious', 'mayb', 'celebr', 'last', 'titl', 'touch', 'moment', 'see', 'ball', 'children', 'stand', 'ovat', 'familiar', 'face', 'audienc', 'alway', 'easi', 'last', 'week']","['federer', 'swiss', 'indoors', 'last', 'week', 'beating', 'romanian', 'qualifier', 'marius', 'copil', 'final', '37yearold', 'claimed', '99th', 'atp', 'title', 'hunting', 'century', 'french', 'capital', 'week', 'federer', 'handed', 'difficult', 'draw', 'could', 'could', 'come', 'across', 'kevin', 'anderson', 'novak', 'djokovic', 'rafael', 'nadal', 'latter', 'round', 'first', '20time', 'grand', 'slam', 'winner', 'want', 'train', 'paris', 'master', 'court', 'afternoon', 'deciding', 'whether', 'appear', 'opening', 'match', 'either', 'milo', 'raonic', 'jowilfried', 'tsonga', 'monday', 'free', 'look', 'feel', 'federer', 'said', 'winning', 'swiss', 'indoors', 'tuesday', 'fly', 'paris', 'train', 'afternoon', 'ready', 'first', 'match', 'wednesday', 'night', 'felt', 'good', 'week', 'better', 'every', 'day', 'also', 'impression', 'stage', 'might', 'better', 'play', 'match', 'train', 'long', 'fear', 'injury', 'play', 'federers', 'success', 'basel', 'last', 'week', 'ninth', 'time', 'hometown', 'tournament', 'delighted', 'watched', 'family', 'friend', 'purchased', '60', 'ticket', 'final', 'dearest', 'child', 'parent', 'sister', 'team', 'federer', 'added', 'always', 'emotional', 'thank', 'team', 'sometimes', 'tilt', 'emotion', 'sometimes', 'stumble', 'mean', 'world', 'make', 'incredibly', 'happy', 'win', 'home', 'tournament', 'make', 'people', 'happy', 'know', 'maybe', 'last', 'title', 'today', 'try', 'lot', 'absorb', 'enjoy', 'moment', 'much', 'consciously', 'maybe', 'celebrate', 'last', 'title', 'touching', 'moment', 'seeing', 'ball', 'child', 'standing', 'ovation', 'familiar', 'face', 'audience', 'always', 'easy', 'last', 'week']",1833,2.8914348063284234
