article_id,Comment,source,Stop_Words_Removed,Stemmed_data,Lemmatized_data,Message_length,Punctuation_Percent
1,"Maria Sharapova has basically no friends as tennis players on the WTA Tour. The Russian player has no problems in openly speaking about it and in a recent interview she said: 'I don't really hide any feelings too much. I think everyone knows this is my job here. When I'm on the courts or when I'm on the court playing, I'm a competitor and I want to beat every single person whether they're in the locker room or across the net.So I'm not the one to strike up a conversation about the weather and know that in the next few minutes I have to go and try to win a tennis match. I'm a pretty competitive girl. I say my hellos, but I'm not sending any players flowers as well. Uhm, I'm not really friendly or close to many players. I have not a lot of friends away from the courts.' When she said she is not really close to a lot of players, is that something strategic that she is doing? Is it different on the men's tour than the women's tour? 'No, not at all. I think just because you're in the same sport doesn't mean that you have to be friends with everyone just because you're categorized, you're a tennis player, so you're going to get along with tennis players. I think every person has different interests. I have friends that have completely different jobs and interests, and I've met them in very different parts of my life. I think everyone just thinks because we're tennis players we should be the greatest of friends. But ultimately tennis is just a very small part of what we do. There are so many other things that we're interested in, that we do.'",https://www.tennisworldusa.org/tennis/news/Maria_Sharapova/62220/i-do-not-have-friends-in-tennis-says-maria-sharapova/,"['maria', 'sharapova', 'basically', 'friends', 'tennis', 'players', 'wta', 'tour', 'russian', 'player', 'problems', 'openly', 'speaking', 'recent', 'interview', 'said', 'dont', 'really', 'hide', 'feelings', 'much', 'think', 'everyone', 'knows', 'job', 'im', 'courts', 'im', 'court', 'playing', 'im', 'competitor', 'want', 'beat', 'every', 'single', 'person', 'whether', 'theyre', 'locker', 'room', 'across', 'netso', 'im', 'one', 'strike', 'conversation', 'weather', 'know', 'next', 'minutes', 'go', 'try', 'win', 'tennis', 'match', 'im', 'pretty', 'competitive', 'girl', 'say', 'hellos', 'im', 'sending', 'players', 'flowers', 'well', 'uhm', 'im', 'really', 'friendly', 'close', 'many', 'players', 'lot', 'friends', 'away', 'courts', 'said', 'really', 'close', 'lot', 'players', 'something', 'strategic', 'different', 'mens', 'tour', 'womens', 'tour', 'think', 'youre', 'sport', 'doesnt', 'mean', 'friends', 'everyone', 'youre', 'categorized', 'youre', 'tennis', 'player', 'youre', 'going', 'get', 'along', 'tennis', 'players', 'think', 'every', 'person', 'different', 'interests', 'friends', 'completely', 'different', 'jobs', 'interests', 'ive', 'met', 'different', 'parts', 'life', 'think', 'everyone', 'thinks', 'tennis', 'players', 'greatest', 'friends', 'ultimately', 'tennis', 'small', 'part', 'many', 'things', 'interested']","['maria', 'sharapova', 'basic', 'friend', 'tenni', 'player', 'wta', 'tour', 'russian', 'player', 'problem', 'openli', 'speak', 'recent', 'interview', 'said', 'dont', 'realli', 'hide', 'feel', 'much', 'think', 'everyon', 'know', 'job', 'im', 'court', 'im', 'court', 'play', 'im', 'competitor', 'want', 'beat', 'everi', 'singl', 'person', 'whether', 'theyr', 'locker', 'room', 'across', 'netso', 'im', 'one', 'strike', 'convers', 'weather', 'know', 'next', 'minut', 'go', 'tri', 'win', 'tenni', 'match', 'im', 'pretti', 'competit', 'girl', 'say', 'hello', 'im', 'send', 'player', 'flower', 'well', 'uhm', 'im', 'realli', 'friendli', 'close', 'mani', 'player', 'lot', 'friend', 'away', 'court', 'said', 'realli', 'close', 'lot', 'player', 'someth', 'strateg', 'differ', 'men', 'tour', 'women', 'tour', 'think', 'your', 'sport', 'doesnt', 'mean', 'friend', 'everyon', 'your', 'categor', 'your', 'tenni', 'player', 'your', 'go', 'get', 'along', 'tenni', 'player', 'think', 'everi', 'person', 'differ', 'interest', 'friend', 'complet', 'differ', 'job', 'interest', 'ive', 'met', 'differ', 'part', 'life', 'think', 'everyon', 'think', 'tenni', 'player', 'greatest', 'friend', 'ultim', 'tenni', 'small', 'part', 'mani', 'thing', 'interest']","['maria', 'sharapova', 'basically', 'friend', 'tennis', 'player', 'wta', 'tour', 'russian', 'player', 'problem', 'openly', 'speaking', 'recent', 'interview', 'said', 'dont', 'really', 'hide', 'feeling', 'much', 'think', 'everyone', 'know', 'job', 'im', 'court', 'im', 'court', 'playing', 'im', 'competitor', 'want', 'beat', 'every', 'single', 'person', 'whether', 'theyre', 'locker', 'room', 'across', 'netso', 'im', 'one', 'strike', 'conversation', 'weather', 'know', 'next', 'minute', 'go', 'try', 'win', 'tennis', 'match', 'im', 'pretty', 'competitive', 'girl', 'say', 'hello', 'im', 'sending', 'player', 'flower', 'well', 'uhm', 'im', 'really', 'friendly', 'close', 'many', 'player', 'lot', 'friend', 'away', 'court', 'said', 'really', 'close', 'lot', 'player', 'something', 'strategic', 'different', 'men', 'tour', 'woman', 'tour', 'think', 'youre', 'sport', 'doesnt', 'mean', 'friend', 'everyone', 'youre', 'categorized', 'youre', 'tennis', 'player', 'youre', 'going', 'get', 'along', 'tennis', 'player', 'think', 'every', 'person', 'different', 'interest', 'friend', 'completely', 'different', 'job', 'interest', 'ive', 'met', 'different', 'part', 'life', 'think', 'everyone', 'think', 'tennis', 'player', 'greatest', 'friend', 'ultimately', 'tennis', 'small', 'part', 'many', 'thing', 'interested']",1561,3.267136450992953
2,"BASEL, Switzerland (AP), Roger Federer advanced to the 14th Swiss Indoors final of his career by beating seventh-seeded Daniil Medvedev 6-1, 6-4 on Saturday. Seeking a ninth title at his hometown event, and a 99th overall, Federer will play 93th-ranked Marius Copil on Sunday. Federer dominated the 20th-ranked Medvedev and had his first match-point chance to break serve again at 5-1. He then dropped his serve to love, and let another match point slip in Medvedev's next service game by netting a backhand. He clinched on his fourth chance when Medvedev netted from the baseline. Copil upset expectations of a Federer final against Alexander Zverev in a 6-3, 6-7 (6), 6-4 win over the fifth-ranked German in the earlier semifinal. The Romanian aims for a first title after arriving at Basel without a career win over a top-10 opponent. Copil has two after also beating No. 6 Marin Cilic in the second round. Copil fired 26 aces past Zverev and never dropped serve, clinching after 2 1/2 hours with a forehand volley winner to break Zverev for the second time in the semifinal. He came through two rounds of qualifying last weekend to reach the Basel main draw, including beating Zverev's older brother, Mischa. Federer had an easier time than in his only previous match against Medvedev, a three-setter at Shanghai two weeks ago.",http://www.tennis.com/pro-game/2018/10/copil-stuns-5th-ranked-zverev-to-reach-swiss-indoors-final/77721/,"['basel', 'switzerland', 'ap', 'roger', 'federer', 'advanced', '14th', 'swiss', 'indoors', 'final', 'career', 'beating', 'seventhseeded', 'daniil', 'medvedev', '61', '64', 'saturday', 'seeking', 'ninth', 'title', 'hometown', 'event', '99th', 'overall', 'federer', 'play', '93thranked', 'marius', 'copil', 'sunday', 'federer', 'dominated', '20thranked', 'medvedev', 'first', 'matchpoint', 'chance', 'break', 'serve', '51', 'dropped', 'serve', 'love', 'let', 'another', 'match', 'point', 'slip', 'medvedevs', 'next', 'service', 'game', 'netting', 'backhand', 'clinched', 'fourth', 'chance', 'medvedev', 'netted', 'baseline', 'copil', 'upset', 'expectations', 'federer', 'final', 'alexander', 'zverev', '63', '67', '6', '64', 'win', 'fifthranked', 'german', 'earlier', 'semifinal', 'romanian', 'aims', 'first', 'title', 'arriving', 'basel', 'without', 'career', 'win', 'top10', 'opponent', 'copil', 'two', 'also', 'beating', '6', 'marin', 'cilic', 'second', 'round', 'copil', 'fired', '26', 'aces', 'past', 'zverev', 'never', 'dropped', 'serve', 'clinching', '2', '12', 'hours', 'forehand', 'volley', 'winner', 'break', 'zverev', 'second', 'time', 'semifinal', 'came', 'two', 'rounds', 'qualifying', 'last', 'weekend', 'reach', 'basel', 'main', 'draw', 'including', 'beating', 'zverevs', 'older', 'brother', 'mischa', 'federer', 'easier', 'time', 'previous', 'match', 'medvedev', 'threesetter', 'shanghai', 'two', 'weeks', 'ago']","['basel', 'switzerland', 'ap', 'roger', 'feder', 'advanc', '14th', 'swiss', 'indoor', 'final', 'career', 'beat', 'seventhseed', 'daniil', 'medvedev', '61', '64', 'saturday', 'seek', 'ninth', 'titl', 'hometown', 'event', '99th', 'overal', 'feder', 'play', '93thrank', 'mariu', 'copil', 'sunday', 'feder', 'domin', '20thrank', 'medvedev', 'first', 'matchpoint', 'chanc', 'break', 'serv', '51', 'drop', 'serv', 'love', 'let', 'anoth', 'match', 'point', 'slip', 'medvedev', 'next', 'servic', 'game', 'net', 'backhand', 'clinch', 'fourth', 'chanc', 'medvedev', 'net', 'baselin', 'copil', 'upset', 'expect', 'feder', 'final', 'alexand', 'zverev', '63', '67', '6', '64', 'win', 'fifthrank', 'german', 'earlier', 'semifin', 'romanian', 'aim', 'first', 'titl', 'arriv', 'basel', 'without', 'career', 'win', 'top10', 'oppon', 'copil', 'two', 'also', 'beat', '6', 'marin', 'cilic', 'second', 'round', 'copil', 'fire', '26', 'ace', 'past', 'zverev', 'never', 'drop', 'serv', 'clinch', '2', '12', 'hour', 'forehand', 'volley', 'winner', 'break', 'zverev', 'second', 'time', 'semifin', 'came', 'two', 'round', 'qualifi', 'last', 'weekend', 'reach', 'basel', 'main', 'draw', 'includ', 'beat', 'zverev', 'older', 'brother', 'mischa', 'feder', 'easier', 'time', 'previou', 'match', 'medvedev', 'threesett', 'shanghai', 'two', 'week', 'ago']","['basel', 'switzerland', 'ap', 'roger', 'federer', 'advanced', '14th', 'swiss', 'indoors', 'final', 'career', 'beating', 'seventhseeded', 'daniil', 'medvedev', '61', '64', 'saturday', 'seeking', 'ninth', 'title', 'hometown', 'event', '99th', 'overall', 'federer', 'play', '93thranked', 'marius', 'copil', 'sunday', 'federer', 'dominated', '20thranked', 'medvedev', 'first', 'matchpoint', 'chance', 'break', 'serve', '51', 'dropped', 'serve', 'love', 'let', 'another', 'match', 'point', 'slip', 'medvedevs', 'next', 'service', 'game', 'netting', 'backhand', 'clinched', 'fourth', 'chance', 'medvedev', 'netted', 'baseline', 'copil', 'upset', 'expectation', 'federer', 'final', 'alexander', 'zverev', '63', '67', '6', '64', 'win', 'fifthranked', 'german', 'earlier', 'semifinal', 'romanian', 'aim', 'first', 'title', 'arriving', 'basel', 'without', 'career', 'win', 'top10', 'opponent', 'copil', 'two', 'also', 'beating', '6', 'marin', 'cilic', 'second', 'round', 'copil', 'fired', '26', 'ace', 'past', 'zverev', 'never', 'dropped', 'serve', 'clinching', '2', '12', 'hour', 'forehand', 'volley', 'winner', 'break', 'zverev', 'second', 'time', 'semifinal', 'came', 'two', 'round', 'qualifying', 'last', 'weekend', 'reach', 'basel', 'main', 'draw', 'including', 'beating', 'zverevs', 'older', 'brother', 'mischa', 'federer', 'easier', 'time', 'previous', 'match', 'medvedev', 'threesetter', 'shanghai', 'two', 'week', 'ago']",1331,3.3057851239669422
3,"Roger Federer has revealed that organisers of the re-launched and condensed Davis Cup gave him three days to decide if he would commit to the controversial competition. Speaking at the Swiss Indoors tournament where he will play in Sundays final against Romanian qualifier Marius Copil, the world number three said that given the impossibly short time frame to make a decision, he opted out of any commitment. ""They only left me three days to decide"", Federer said. ""I didn't to have time to consult with all the people I had to consult. ""I could not make a decision in that time, so I told them to do what they wanted."" The 20-time Grand Slam champion has voiced doubts about the wisdom of the one-week format to be introduced by organisers Kosmos, who have promised the International Tennis Federation up to $3 billion in prize money over the next quarter-century. The competition is set to feature 18 countries in the November 18-24 finals in Madrid next year, and will replace the classic home-and-away ties played four times per year for decades. Kosmos is headed by Barcelona footballer Gerard Pique, who is hoping fellow Spaniard Rafael Nadal will play in the upcoming event. Novak Djokovic has said he will give precedence to the ATP's intended re-launch of the defunct World Team Cup in January 2020, at various Australian venues. Major players feel that a big event in late November combined with one in January before the Australian Open will mean too much tennis and too little rest. Federer said earlier this month in Shanghai in that his chances of playing the Davis Cup were all but non-existent. ""I highly doubt it, of course. We will see what happens,"" he said. ""I do not think this was designed for me, anyhow. This was designed for the future generation of players."" Argentina and Britain received wild cards to the new-look event, and will compete along with the four 2018 semi-finalists and the 12 teams who win qualifying rounds next February. ""I don't like being under that kind of pressure,"" Federer said of the deadline Kosmos handed him.",https://scroll.in/field/899938/tennis-roger-federer-ignored-deadline-set-by-new-davis-cup,"['roger', 'federer', 'revealed', 'organisers', 'relaunched', 'condensed', 'davis', 'cup', 'gave', 'three', 'days', 'decide', 'would', 'commit', 'controversial', 'competition', 'speaking', 'swiss', 'indoors', 'tournament', 'play', 'sundays', 'final', 'romanian', 'qualifier', 'marius', 'copil', 'world', 'number', 'three', 'said', 'given', 'impossibly', 'short', 'time', 'frame', 'make', 'decision', 'opted', 'commitment', 'left', 'three', 'days', 'decide', 'federer', 'said', 'didnt', 'time', 'consult', 'people', 'consult', 'could', 'make', 'decision', 'time', 'told', 'wanted', '20time', 'grand', 'slam', 'champion', 'voiced', 'doubts', 'wisdom', 'oneweek', 'format', 'introduced', 'organisers', 'kosmos', 'promised', 'international', 'tennis', 'federation', '3', 'billion', 'prize', 'money', 'next', 'quartercentury', 'competition', 'set', 'feature', '18', 'countries', 'november', '1824', 'finals', 'madrid', 'next', 'year', 'replace', 'classic', 'homeandaway', 'ties', 'played', 'four', 'times', 'per', 'year', 'decades', 'kosmos', 'headed', 'barcelona', 'footballer', 'gerard', 'pique', 'hoping', 'fellow', 'spaniard', 'rafael', 'nadal', 'play', 'upcoming', 'event', 'novak', 'djokovic', 'said', 'give', 'precedence', 'atps', 'intended', 'relaunch', 'defunct', 'world', 'team', 'cup', 'january', '2020', 'various', 'australian', 'venues', 'major', 'players', 'feel', 'big', 'event', 'late', 'november', 'combined', 'one', 'january', 'australian', 'open', 'mean', 'much', 'tennis', 'little', 'rest', 'federer', 'said', 'earlier', 'month', 'shanghai', 'chances', 'playing', 'davis', 'cup', 'nonexistent', 'highly', 'doubt', 'course', 'see', 'happens', 'said', 'think', 'designed', 'anyhow', 'designed', 'future', 'generation', 'players', 'argentina', 'britain', 'received', 'wild', 'cards', 'newlook', 'event', 'compete', 'along', 'four', '2018', 'semifinalists', '12', 'teams', 'win', 'qualifying', 'rounds', 'next', 'february', 'dont', 'like', 'kind', 'pressure', 'federer', 'said', 'deadline', 'kosmos', 'handed']","['roger', 'feder', 'reveal', 'organis', 'relaunch', 'condens', 'davi', 'cup', 'gave', 'three', 'day', 'decid', 'would', 'commit', 'controversi', 'competit', 'speak', 'swiss', 'indoor', 'tournament', 'play', 'sunday', 'final', 'romanian', 'qualifi', 'mariu', 'copil', 'world', 'number', 'three', 'said', 'given', 'imposs', 'short', 'time', 'frame', 'make', 'decis', 'opt', 'commit', 'left', 'three', 'day', 'decid', 'feder', 'said', 'didnt', 'time', 'consult', 'peopl', 'consult', 'could', 'make', 'decis', 'time', 'told', 'want', '20time', 'grand', 'slam', 'champion', 'voic', 'doubt', 'wisdom', 'oneweek', 'format', 'introduc', 'organis', 'kosmo', 'promis', 'intern', 'tenni', 'feder', '3', 'billion', 'prize', 'money', 'next', 'quartercenturi', 'competit', 'set', 'featur', '18', 'countri', 'novemb', '1824', 'final', 'madrid', 'next', 'year', 'replac', 'classic', 'homeandaway', 'tie', 'play', 'four', 'time', 'per', 'year', 'decad', 'kosmo', 'head', 'barcelona', 'footbal', 'gerard', 'piqu', 'hope', 'fellow', 'spaniard', 'rafael', 'nadal', 'play', 'upcom', 'event', 'novak', 'djokov', 'said', 'give', 'preced', 'atp', 'intend', 'relaunch', 'defunct', 'world', 'team', 'cup', 'januari', '2020', 'variou', 'australian', 'venu', 'major', 'player', 'feel', 'big', 'event', 'late', 'novemb', 'combin', 'one', 'januari', 'australian', 'open', 'mean', 'much', 'tenni', 'littl', 'rest', 'feder', 'said', 'earlier', 'month', 'shanghai', 'chanc', 'play', 'davi', 'cup', 'nonexist', 'highli', 'doubt', 'cours', 'see', 'happen', 'said', 'think', 'design', 'anyhow', 'design', 'futur', 'gener', 'player', 'argentina', 'britain', 'receiv', 'wild', 'card', 'newlook', 'event', 'compet', 'along', 'four', '2018', 'semifinalist', '12', 'team', 'win', 'qualifi', 'round', 'next', 'februari', 'dont', 'like', 'kind', 'pressur', 'feder', 'said', 'deadlin', 'kosmo', 'hand']","['roger', 'federer', 'revealed', 'organiser', 'relaunched', 'condensed', 'davis', 'cup', 'gave', 'three', 'day', 'decide', 'would', 'commit', 'controversial', 'competition', 'speaking', 'swiss', 'indoors', 'tournament', 'play', 'sunday', 'final', 'romanian', 'qualifier', 'marius', 'copil', 'world', 'number', 'three', 'said', 'given', 'impossibly', 'short', 'time', 'frame', 'make', 'decision', 'opted', 'commitment', 'left', 'three', 'day', 'decide', 'federer', 'said', 'didnt', 'time', 'consult', 'people', 'consult', 'could', 'make', 'decision', 'time', 'told', 'wanted', '20time', 'grand', 'slam', 'champion', 'voiced', 'doubt', 'wisdom', 'oneweek', 'format', 'introduced', 'organiser', 'kosmos', 'promised', 'international', 'tennis', 'federation', '3', 'billion', 'prize', 'money', 'next', 'quartercentury', 'competition', 'set', 'feature', '18', 'country', 'november', '1824', 'final', 'madrid', 'next', 'year', 'replace', 'classic', 'homeandaway', 'tie', 'played', 'four', 'time', 'per', 'year', 'decade', 'kosmos', 'headed', 'barcelona', 'footballer', 'gerard', 'pique', 'hoping', 'fellow', 'spaniard', 'rafael', 'nadal', 'play', 'upcoming', 'event', 'novak', 'djokovic', 'said', 'give', 'precedence', 'atp', 'intended', 'relaunch', 'defunct', 'world', 'team', 'cup', 'january', '2020', 'various', 'australian', 'venue', 'major', 'player', 'feel', 'big', 'event', 'late', 'november', 'combined', 'one', 'january', 'australian', 'open', 'mean', 'much', 'tennis', 'little', 'rest', 'federer', 'said', 'earlier', 'month', 'shanghai', 'chance', 'playing', 'davis', 'cup', 'nonexistent', 'highly', 'doubt', 'course', 'see', 'happens', 'said', 'think', 'designed', 'anyhow', 'designed', 'future', 'generation', 'player', 'argentina', 'britain', 'received', 'wild', 'card', 'newlook', 'event', 'compete', 'along', 'four', '2018', 'semifinalist', '12', 'team', 'win', 'qualifying', 'round', 'next', 'february', 'dont', 'like', 'kind', 'pressure', 'federer', 'said', 'deadline', 'kosmos', 'handed']",2063,2.714493456131847
4,"Kei Nishikori will try to end his long losing streak in ATP finals and Kevin Anderson will go for his second title of the year at the Erste Bank Open on Sunday. The fifth-seeded Nishikori reached his third final of 2018 after beating Mikhail Kukushkin of Kazakhstan 6-4, 6-3 in the semifinals. A winner of 11 ATP events, Nishikori hasn't triumphed since winning in Memphis in February 2016. He has lost eight straight finals since. The second-seeded Anderson defeated Fernando Verdasco 6-3, 3-6, 6-4. Anderson has a shot at a fifth career title and second of the year after winning in New York in February. Nishikori leads Anderson 4-2 on career matchups, but the South African won their only previous meeting this year. With a victory on Sunday, Anderson will qualify for the ATP Finals. Currently in ninth place, Nishikori with a win could move to within 125 points of the cut for the eight-man event in London next month. Nishikori held serve throughout against Kukushkin, who came through qualifying. He used his first break point to close out the first set before going up 3-0 in the second and wrapping up the win on his first match point. Against Verdasco, Anderson hit nine of his 19 aces in the opening set. The Spaniard broke Anderson twice in the second but didn't get another chance on the South African's serve in the final set.",http://www.tennis.com/pro-game/2018/10/nishikori-beats-kukushkin-in-vienna-for-3rd-final-of-season/77719/,"['kei', 'nishikori', 'try', 'end', 'long', 'losing', 'streak', 'atp', 'finals', 'kevin', 'anderson', 'go', 'second', 'title', 'year', 'erste', 'bank', 'open', 'sunday', 'fifthseeded', 'nishikori', 'reached', 'third', 'final', '2018', 'beating', 'mikhail', 'kukushkin', 'kazakhstan', '64', '63', 'semifinals', 'winner', '11', 'atp', 'events', 'nishikori', 'hasnt', 'triumphed', 'since', 'winning', 'memphis', 'february', '2016', 'lost', 'eight', 'straight', 'finals', 'since', 'secondseeded', 'anderson', 'defeated', 'fernando', 'verdasco', '63', '36', '64', 'anderson', 'shot', 'fifth', 'career', 'title', 'second', 'year', 'winning', 'new', 'york', 'february', 'nishikori', 'leads', 'anderson', '42', 'career', 'matchups', 'south', 'african', 'previous', 'meeting', 'year', 'victory', 'sunday', 'anderson', 'qualify', 'atp', 'finals', 'currently', 'ninth', 'place', 'nishikori', 'win', 'could', 'move', 'within', '125', 'points', 'cut', 'eightman', 'event', 'london', 'next', 'month', 'nishikori', 'held', 'serve', 'throughout', 'kukushkin', 'came', 'qualifying', 'used', 'first', 'break', 'point', 'close', 'first', 'set', 'going', '30', 'second', 'wrapping', 'win', 'first', 'match', 'point', 'verdasco', 'anderson', 'hit', 'nine', '19', 'aces', 'opening', 'set', 'spaniard', 'broke', 'anderson', 'twice', 'second', 'didnt', 'get', 'another', 'chance', 'south', 'africans', 'serve', 'final', 'set']","['kei', 'nishikori', 'tri', 'end', 'long', 'lose', 'streak', 'atp', 'final', 'kevin', 'anderson', 'go', 'second', 'titl', 'year', 'erst', 'bank', 'open', 'sunday', 'fifthseed', 'nishikori', 'reach', 'third', 'final', '2018', 'beat', 'mikhail', 'kukushkin', 'kazakhstan', '64', '63', 'semifin', 'winner', '11', 'atp', 'event', 'nishikori', 'hasnt', 'triumph', 'sinc', 'win', 'memphi', 'februari', '2016', 'lost', 'eight', 'straight', 'final', 'sinc', 'secondseed', 'anderson', 'defeat', 'fernando', 'verdasco', '63', '36', '64', 'anderson', 'shot', 'fifth', 'career', 'titl', 'second', 'year', 'win', 'new', 'york', 'februari', 'nishikori', 'lead', 'anderson', '42', 'career', 'matchup', 'south', 'african', 'previou', 'meet', 'year', 'victori', 'sunday', 'anderson', 'qualifi', 'atp', 'final', 'current', 'ninth', 'place', 'nishikori', 'win', 'could', 'move', 'within', '125', 'point', 'cut', 'eightman', 'event', 'london', 'next', 'month', 'nishikori', 'held', 'serv', 'throughout', 'kukushkin', 'came', 'qualifi', 'use', 'first', 'break', 'point', 'close', 'first', 'set', 'go', '30', 'second', 'wrap', 'win', 'first', 'match', 'point', 'verdasco', 'anderson', 'hit', 'nine', '19', 'ace', 'open', 'set', 'spaniard', 'broke', 'anderson', 'twice', 'second', 'didnt', 'get', 'anoth', 'chanc', 'south', 'african', 'serv', 'final', 'set']","['kei', 'nishikori', 'try', 'end', 'long', 'losing', 'streak', 'atp', 'final', 'kevin', 'anderson', 'go', 'second', 'title', 'year', 'erste', 'bank', 'open', 'sunday', 'fifthseeded', 'nishikori', 'reached', 'third', 'final', '2018', 'beating', 'mikhail', 'kukushkin', 'kazakhstan', '64', '63', 'semifinal', 'winner', '11', 'atp', 'event', 'nishikori', 'hasnt', 'triumphed', 'since', 'winning', 'memphis', 'february', '2016', 'lost', 'eight', 'straight', 'final', 'since', 'secondseeded', 'anderson', 'defeated', 'fernando', 'verdasco', '63', '36', '64', 'anderson', 'shot', 'fifth', 'career', 'title', 'second', 'year', 'winning', 'new', 'york', 'february', 'nishikori', 'lead', 'anderson', '42', 'career', 'matchup', 'south', 'african', 'previous', 'meeting', 'year', 'victory', 'sunday', 'anderson', 'qualify', 'atp', 'final', 'currently', 'ninth', 'place', 'nishikori', 'win', 'could', 'move', 'within', '125', 'point', 'cut', 'eightman', 'event', 'london', 'next', 'month', 'nishikori', 'held', 'serve', 'throughout', 'kukushkin', 'came', 'qualifying', 'used', 'first', 'break', 'point', 'close', 'first', 'set', 'going', '30', 'second', 'wrapping', 'win', 'first', 'match', 'point', 'verdasco', 'anderson', 'hit', 'nine', '19', 'ace', 'opening', 'set', 'spaniard', 'broke', 'anderson', 'twice', 'second', 'didnt', 'get', 'another', 'chance', 'south', 'african', 'serve', 'final', 'set']",1341,2.609992542878449
